{
  "$schema": "https://json-schema.org/draft/2020-12/schema",
  "$id": "https://flowly.local/contracts/schemas/transaction.schema.json",
  "title": "Transaction",
  "description": "A transaction. `amountMinor` is signed: inflows positive, outflows negative. `counterpartyIban` is the account on the other side when the bank names it, compacted and uppercased. `transfer` marks a movement that only moves money between the user's own accounts: absent means undecided, a boolean is the user's decision, and `true` keeps the row out of income, expenses and spending.",
  "type": "object",
  "additionalProperties": false,
  "required": [
    "formatVersion",
    "revision",
    "id",
    "accountId",
    "bookingDate",
    "amountMinor",
    "currency",
    "status",
    "source",
    "tagIds",
    "createdAt",
    "updatedAt"
  ],
  "properties": {
    "formatVersion": { "const": 1 },
    "revision": { "type": "integer", "minimum": 1 },
    "id": { "type": "string", "format": "uuid" },
    "accountId": { "type": "string", "format": "uuid" },
    "bookingDate": { "type": "string", "format": "date" },
    "valueDate": { "type": "string", "format": "date" },
    "amountMinor": { "type": "integer" },
    "currency": { "type": "string", "pattern": "^[A-Z]{3}$" },
    "originalAmountMinor": { "type": "integer" },
    "originalCurrency": { "type": "string", "pattern": "^[A-Z]{3}$" },
    "payee": { "type": "string", "maxLength": 120 },
    "description": { "type": "string", "maxLength": 500 },
    "userNote": { "type": "string", "maxLength": 2000 },
    "status": { "enum": ["pending", "booked"] },
    "source": { "enum": ["manual", "csv-import", "enable-banking"] },
    "tagIds": {
      "type": "array",
      "maxItems": 100,
      "uniqueItems": true,
      "items": { "type": "string", "format": "uuid" }
    },
    "provider": { "type": "string", "maxLength": 60 },
    "providerAccountId": { "type": "string", "maxLength": 200 },
    "providerTransactionId": { "type": "string", "maxLength": 200 },
    "importFingerprint": { "type": "string", "pattern": "^[0-9a-f]{32}$" },
    "transfer": { "type": "boolean" },
    "counterpartyIban": {
      "type": "string",
      "pattern": "^[A-Z]{2}[0-9A-Z]{11,32}$",
      "description": "The account on the other side of the movement, compacted and uppercased, when the bank prints it on its own leg. It is what lets transfer pairing compare against the user's own accounts instead of reading the payee."
    },
    "createdAt": { "type": "string", "format": "date-time" },
    "updatedAt": { "type": "string", "format": "date-time" }
  }
}
